{"coverageSegments":[{"endMS":1000,"evidenceRefs":[],"startMS":0,"status":"unknown"},{"endMS":1001,"evidenceRefs":[{"id":"FixtureRawQuotes","sha256":"ed18adb1eec58a7813436df138f83bd84d87f7da0fa47c7ba7b1e1e65635aadf","version":"v1"}],"startMS":1000,"status":"complete-claimed"},{"endMS":1002,"evidenceRefs":[],"startMS":1001,"status":"unknown"},{"endMS":1003,"evidenceRefs":[{"id":"FixtureRawQuotes","sha256":"ed18adb1eec58a7813436df138f83bd84d87f7da0fa47c7ba7b1e1e65635aadf","version":"v1"}],"startMS":1002,"status":"complete-claimed"},{"endMS":2000,"evidenceRefs":[],"startMS":1003,"status":"unknown"}],"dataset":"SyntheticGoldTicks","decoder":{"id":"FixtureCSVDecoder","method":"preserve-all-records-in-original-order-without-sort-repair-or-drop","version":"v1"},"id":"FixtureQuoteSource","normalizationVersion":"frozen-quote-snapshot-normalization-v1","normalizedSnapshotSHA256":"2453504318f9298f5b799e8a99024feae6e62024926ca2f31ddba714444d3d09","priceUnits":"USD-per-troy-ounce","provider":"SyntheticProvider","rawArtifact":{"byteCount":90,"format":"fixture-csv-v1","recordCount":4,"ref":{"id":"FixtureRawQuotes","sha256":"ed18adb1eec58a7813436df138f83bd84d87f7da0fa47c7ba7b1e1e65635aadf","version":"v1"}},"schema":"frozen-quote-source-v1","snapshotRef":{"id":"FixtureSnapshot","sha256":"91493495c07cc1246a74ae2365ca59d034678719e27cadae446b145f83399f66","version":"v1"},"supportingArtifacts":[],"symbol":"XAUUSD","version":"v1","windows":{"evaluation":{"endMS":2000,"startMS":1000},"warmup":{"endMS":1000,"startMS":0}}}
